;Phrase
1251;No hay muchas esperanzas de que Gollum tenga cura antes de morir, pero creo que aún podría salvarse: está ligado al destino del Anillo
1252;El corazón me dice que todavía tiene un papel que desempeñar, para bien o para mal, antes del fin y cuando éste llegue, la misericordia de Bilbo puede determinar el destino de muchos, no menos que el tuyo
1253;"De cualquier modo no lo hemos matado; es muy anciano y muy infeliz"
1254;Los elfos de los bosques lo tienen prisionero, pero lo tratan con toda la benevolencia que es posible esperar de esos prudentes corazones
1255;De todos modos dijo Frodo, aunque Bilbo no haya matado a Gollum, yo hubiese preferido que no se quedara con el Anillo
1256;Desearía que nunca lo hubiese encontrado y querría no tenerlo ahora.¿Por qué permites que lo conserve? ¿Por qué no me obligas a que lo tire o que lo destruya? ¿Permitirte? ¿Obligarte? respondió el mago.¿No has oído todo lo que te dije? No piensas lo que estás diciendo
1257;Tirarlo sería una equivocación
1258;Estos Anillos saben cómo hacerse encontrar
1259;En malas manos podría hacer mucho daño
1260;Y lo peor de todo es que podría caer en poder del enemigo
1261;En efecto, podría, pues es el Unico y el enemigo está ejerciendo todo su poder para encontrarlo o atraerlo
1262;»Por supuesto, mi querido Frodo, tú estabas en peligro, cosa que me trastornó profundamente
1263;Pero había tanto en juego que tuve que arriesgarme, aunque durante mi ausencia no paso un día sin que ojos vigilantes cuidaran la Comarca
1264;Mientras no lo uses, no creo que el Anillo tenga algún efecto negativo sobre ti, o en todo caso no durante un tiempo
1265;Recuerda que hace nueve años, cuando te vi por última vez, yo no sabía mucho
1266;Pero...¿por qué no destruirlo? Tendría que haber sido destruido hace tiempo, dijiste volvió a exclamar Frodo
1267;Si me hubieses advertido, o me hubieses enviado un mensaje, yo lo hubiera destruido
1268;¿De veras? ¿Cómo? ¿Lo intentaste alguna vez? No
1269;Pero supongo que podr ía deshacerlo a martillazos o fundirlo
1270;¡Prueba! dijo Gandalf.¡Prueba ahora!  Frodo sacó de nuevo el Anillo y lo miró
1271;Parecía liso y suave, sin ninguna marca visible
1272;El oro era brillante y puro y Frodo admiró la hermosura y vivacidad del color y la perfección de la forma
1273;Era admirable, una verdadera joya
1274;Cuando lo sacó del bolsillo había pensado en arrojarlo lejos, a la parte El Señor de los anillos: La Comunidad del anillo 51 más caliente del fuego
1275;Comprobó que no podía, que tenía que vencer una enorme resistencia
1276;Sopesó el Anillo en la mano, titubeando y tratando de recordar lo que Gandalf le había dicho y entonces, recurriendo a toda su voluntad, hizo un movimiento para arrojarlo a las llamas, y en seguida advirtió que había vuelto a guardarlo en el bolsillo
1277;Gandalf rió torvamente.¿Ves, Frodo? Tampoco tú puedes deshacerte de él ni dañarlo
1278;Y yo no podría obligarte, sino por la fuerza, en cuyo caso te arruinaría la mente
1279;Para acabar con el Anillo, de nada sirve la fuerza
1280;No le harías daño aunque lo golpearas con un martillo pesado
1281;Ni tus ma nos ni las mías podrían destruirlo
1282;»Tu pequeño fuego apenas podría fundir el oro común
1283;Este Anillo ha pasado ya por ese fuego y ni siquiera se calentó
1284;"No hay forja en la Comarca que pueda cambiarlo en lo más mínimo; aun los hornos y yunques de los enanos no podrían hacerle nada"
1285;Se ha dicho que el fuego de los dragones podía fundir y consumir los Anillos de Poder, pero no hay ahora ningún dragón que tenga ese fuego: ni siquiera Ancalagon el Negro podría dañar el Anillo Unico, el Anillo Soberano, pues fue fabricado por el mismo Sauron
1286;»Hay un solo camino: encontrar las Grietas del Destino, en las profundidades de Orodruin, la Montaña de Fuego, y arrojar allí el Anillo
1287;Esto siempre que quieras destruirlo de veras, e impedir que caiga en manos enemigas
1288;¡Quiero destruirlo de veras! exclamó Frodo .O que lo destruyan
1289;No estoy hecho para empresas peligrosas
1290;Hubiese preferido no haberlo visto nunca.¿Por qué vino a mí? ¿Por qué fui elegido? Preguntas que nadie puede responder dijo Gandalf .De lo que puedes estar seguro es de que no fue por ningún mérito que otros no tengan
1291;Ni por poder ni por sabiduría, a lo menos
1292;Pero has sido elegido y necesitarás de todos tus recursos: fuerza, ánimo, inteligencia
1293;¡Tengo tan poco de esas cosas! Tú eres sabio y poderoso.¿No quieres el Anillo? ¡No, no! exclamó Gandalf, incorporándose
1294;Mi poder sería entonces demasiado grande y terrible
1295;Conmigo el Anillo adquiriría un poder todavía mayor y más mortal.Los ojos de Gandalf relampaguearon y la cara se le iluminó como con un fuego interior
1296;¡No me tientes! Pues no quiero convertirme en algo semejante al Señor Oscuro
1297;Todo mi interés por el Anillo se basa en la misericordia, misericordia por los débiles y deseo de poder hacer el bien.¡No me tientes! No me atrevo a tomarlo, ni siquiera para esconderlo y que nadie lo use
1298;La tentación de recurrir al Anillo sería para mí demasiado fuerte.¡Tal vez lo necesitara! Me acechan grandes peligros
1299;Gandalf fue hacia la ventana, descorrió las cortinas y abrió los postigos
1300;"El sol entró nuevamente en la habitación; Sam pasaba silbando por el sendero"
1301;Y ahora dijo el mago volviéndose hacia Frodo, la decisión depende de ti
1302;Pero no olvides que puedes contar siempre conmigo.Puso una mano sobre el hombro de Frodo.Te ayudaré a soportar esta carga todo el tiempo que sea necesario
1303;Pero tenemos que hacer algo rápido
1304;El enemigo no se está quieto
1305;Hubo un largo silencio
1306;"Gandalf volvió a sentarse; fumaba la pipa como perdido en sus pensamientos"
1307;Parecía tener los ojos cerrados, pero observaba a Frodo con atención, entornando los párpados
1308;Frodo miraba fijamente las enrojecidas ascuas del hogar, hasta que creyó estar hundiendo los ojos en El Señor de los anillos: La Comunidad del anillo 52 unos pozos profundos y llameantes
1309;Pensaba en las fabulosas Grietas del Destino y en el terror de la Montaña de Fuego
1310;Bien dijo Gandalf por último.¿En qué piensas? ¿Has tomado una decisión? No respondió Frodo volviendo en sí desde las tinieblas, viendo por la ventana el jardín soleado, y sorprendiéndose de que no fuera todavía de noche.O quizá sí
1311;De acuerdo con lo que entendí de tus palabras supongo que he de conservar el Anillo, al menos por ahora, me haga lo que me haga
1312;Cualquier cosa que te haga, será muy lentamente, si lo guardas con ese propósito dijo Gandalf
1313;"Así lo espero respondió Frodo; pero también espero que encuentres un guardián mejor que yo y pronto"
1314;Por el momento parece que soy un peligro para mis vecinos
1315;No puedo conservar el Anillo y quedarme aquí
1316;Tengo que salir de Bolsón Cerrado, abandonar la Comarca, abandonarlo todo e irme.Suspiró.Me gustaría salvar la Comarca, si pudiera, aunque alguna vez pensé que los habitantes eran tan estúpidos que un terremoto o una invasión de dragones les vendría bien
1317;No siento lo mismo ahora
1318;"Siento que mientras la Comarca continúe a salvo, en paz y tranquila, mis peregrinajes serán más soportables; sabré que en alguna parte hay suelo firme, aunque yo nunca vuelva a pisarlo"
1319;»Por supuesto, muchas veces pensé en irme, pero lo imaginaba como una especie de vacaciones, como una serie de aventuras semejantes a las de Bilbo, o mejores, con un final feliz
1320;Esto, en cambio, significa exiliarse, escapar de un peligro a otro y ellos siempre detrás, mordiéndome los talones
1321;Supongo que he de partir solo si decido irme y salvar la Comarca, pero me siento pequeño, y desarraigado...y desesperado
1322;El enemigo es tan fuerte y terrible
1323;No se lo dijo a Gandalf, pero mientras hablaba se le había encendido en el corazón el deseo de seguir a Bilbo y de encontrarlo tal vez
1324;"Era tan fuerte que se sobrepuso al temor; podría casi haber salido corriendo camino abajo, sin sombrero, como lo había hecho Bilbo tiempo atrás, en una mañana muy similar"
1325;Mi querido Frodo exclamó Gandalf, los hobbits son criaturas realmente sorprendentes, como ya he dicho
1326;Puedes aprender todo lo que se refiere a sus costumbres y modos en un mes y después de cien años aún te sorprenderán
1327;"Además no esperaba obtener esa respuesta, ni siquiera de ti; pero Bilbo no se equivocó al elegir el heredero, aunque no pensó demasiado en la importancia que tendría esa elección"
1328;Temo que estés en lo cierto
1329;"El Anillo no podrá permanecer mucho tiempo oculto en la Comarca; y para tu propio bien, tanto como para el de los demás, convendría que te fueras y dejaras de llamarte Bolsón"
1330;Ese nombre no te daría ninguna seguridad fuera de la Comarca ni en las tierras vírgenes
1331;Te daré un seudónimo para tu viaje: serás el señor Sotomonte
1332;»No creo que necesites partir solo
1333;No si conoces a alguien de confianza que quisiera acompañarte y a quien pudieras exponer a peligros desconocidos
1334;Pero si buscas compañía, ten cuidado en cómo eliges
1335;Y ten aún más cuidado con lo que dices, hasta a tus amigos más íntimos
1336;El enemigo tiene muchos espías y muchas maneras de enterarse
1337;De pronto Gandalf se detuvo, como si escuchara
1338;Frodo notó que había mucho silencio, adentro y afuera
1339;"Gandalf se deslizó hacia un costado de la ventana; en seguida, como una flecha, saltó al antepecho y con un rápido El Señor de los anillos: La Comunidad del anillo 53 movimiento extendió el largo brazo afuera y abajo"
1340;Se oyó un graznido y la mano de Gandalf reapareció sosteniendo por una oreja la ensortijada cabeza de Sam Gamyi
1341;Bien, bien, ¡bendita sea mi barba! exclamó Gandalf.¿No se trata de Sam Gamyi? ¿Qué hacías por aquí? El cielo bendiga al señor Gandalf respondió Sam.¡Nada! Recortaba el césped bajo la ventana, ¿no ve usted? Tomó las tijeras y las mostró como una prueba
1342;No, no veo dijo Gandalf ásperamente
1343;Hace rato que no oigo tus tijeras.¿Cuánto tiempo estuviste fisgoneando? ¿Fisgoneando, señor? Perdón, no lo entiendo
1344;No entiendo de qué me habla
1345;No hay nada de eso en Bolsón Cerrado
1346;Los ojos de Gandalf relampaguearon y las cejas se le erizaron como cerdas.No seas tonto.¿Que has oído y por qué has escuchado? ¡Señor Frodo! gritó Sam, temblando
1347;No le permita que me haga daño, señor
1348;No le permita que me transforme en un monstruo
1349;Mi viejo padre me rechazaría.¡No quise hacer nada malo! ¡Se lo juro, señor! No te hará daño respondió Frodo sofocando la risa, aunque asombrado y algo confundido
1350;Él sabe tan bien como yo que no tenías malas intenciones
1351;Pero levántate y contesta en seguida
1352;Bien, señor dijo Sam, tembloroso
1353;Oí un montón de cosas incomprensibles sobre un enemigo, anillos, el señor Bilbo, señor, dragones, una montaña de fuego y...elfos, señor
1354;"Escuché porque no pude evitarlo, usted me entiende; pero ¡el señor me perdone!, adoro esas historias y creo en ellas, contra todo lo que Ted diga.¡Elf os, señor! Me encantaría verlos.¿Podría llevarme con usted a ver a los elfos, señor, cuando usted vaya? De repente Gandalf se echó a reír.¡Entra! gritó, y sacando los brazos fuera levantó al asombrado Sam junto con la azada, las tijeras de podar y demás y lo metió por la ventana, depositándolo en el suelo"
1355;Que te lleve a ver a los elfos, ¿eh? dijo Gandalf, observando de cerca a Sam, mientras una sonrisa le bailaba en la cara.¿Entonces oíste que el señor Frodo se va? Lo oí, señor y por eso me atraganté y usted parece que me oyó
1356;Traté de evitarlo, señor, pero no pude.¡Estaba tan trastornado! No hay nada que hacer, Sam respondió Frodo tristemente
1357;Entendía de pronto que el dolor de abandonar la Comarca sería mucho mayor que el de despedirse de las comodidades de Bolsón Cerrado
1358;Tendré que irme, pero si tú me aprecias de verdad y aquí observó a Sam fijamente, guardarás absoluto secreto.¿Entiendes? Si así no lo haces, o si repites una sola palabra de lo que aquí has oído, espero que Gandalf te transforme en un sapo y luego llene de culebras el jardín
1359;Sam se arrodilló temblando
1360;Levántate, Sam le ordenó Gandalf .He estado pensando en algo mejor
1361;Algo que te cierre la boca y te castigue por haber escuchado: irás con el señor Frodo
1362;¿Yo, señor? gritó Sam, saltando de alegría, como un perro al que invitan a un paseo .¿Yo veré a los elfos y todo? ¡Hurra! gritó, y de pronto se echó a llorar
1363;El Señor de los anillos: La Comunidad del anillo 54 3 TRES ES COMPAÑIA Tienes que irte en silencio, y pronto dijo Gandalf
1364;Habían pasado dos o tres semanas y Frodo no daba señales de estar listo.Lo sé, pero es difícil hacerlas dos cosas objetó
1365;Si desapareciese como Bilbo, la noticia se difundiría en seguida por toda la Comarca
1366;No conviene que desaparezcas, por supuesto dijo Gandalf .He dicho pronto, no ahora
1367;Si se te ocurre algún modo de dejar la Comarca sin despertar sospechas, creo que vale la pena esperar
1368;Pero no lo postergues demasiado.¿Qué tal en el otoño o después de nuestro cumpleaños? preguntó Frodo
1369;Creo que podré arreglar algo para entonces
1370;A decir verdad, se resistía a la idea de partir, ahora que se había decidido
1371;Bolsón Cerrado le parecía una residencia agradable, mucho más que en el pasado reciente y quería saborear al máximo ese último verano en la Comarca
1372;Sabía que cuando llegara el otoño una parte de su corazón aceptaría mejor la idea de un viaje, como le sucedía siempre en esa estación
1373;"Intimamente ya había decidido partir en su quincuagésimo cumpleaños; el centésimo vigesimoctavo de Bilbo"
1374;Le parecía un día apropiado para partir y seguir a Bilbo
1375;Seguir a Bilbo era el objetivo principal y lo único que hacía soportable la idea de la partida
1376;Pensaba lo menos posible en el Anillo y en el fin al que éste podría llevarlo
1377;Pero no le dijo a Gandalf todo lo que pensaba
1378;Lo que el mago adivinaba era siempre difícil de saber
1379;Gandalf miró a Frodo y sonrió: Muy bien dijo
1380;Estoy de acuerdo con la fecha, pero no te retrases más
1381;Ya empiezo a inquietarme
1382;En el ínterin, ten cuidado, ¡no dejes escapar ni palabra sobre adónde piensas ir! Y cuida de que Sam Gamyi no hable
1383;Si habla, lo transformaré de veras en un sapo.En cuanto adónde iré dijo Frodo, será muy difícil decirlo, pues ni yo lo sé todavía
1384;¡No seas absurdo! exclamó Gandalf.¡No te advierto que no dejes tu dirección en la oficina de correos! Pero abandonas la Comarca y eso no ha de saberse hasta que estés muy lejos de aquí
1385;"Tienes que ir, o al menos partir, hacia el sur, el norte, el este, o el oeste; y nadie ha de conocer el rumbo"
1386;He estado tan ocupado con la idea de dejar Bolsón Cerrado y con la despedida que ni siquiera he pensado en el rumbo dijo Frodo
1387;Porque, ¿a dónde iré? ¿Qué me guiará? ¿Cuál será mi tarea? Bilbo fue en busca de un tesoro y volvió, pero yo voy a perderlo y no volveré, según veo
1388;Pero no ves muy lejos dijo Gandalf , ni yo tampoco
1389;Tu tarea puede ser encontrar las Grietas del Destino, pero quizás ese trabajo esté reservado a otros
1390;No lo sé
1391;De cualquier modo, aún no estás preparado para un camino tan largo
1392;"En efecto, no dijo Frodo ; pero mientras tanto, ¿qué ruta tengo, que tomar? Hacia el peligro, de modo no demasiado directo ni demasiado imprudente respondió el mago"
1393;Si quieres mi consejo: ve a Rivendel
1394;El viaje no será tan peligroso, aunque el camino es más difícil de lo que era hace un tiempo y será todavía peor cuando el año llegue a su fin, El Señor de los anillos: La Comunidad del anillo 55 ¡Rivendel! dijo Frodo
1395;Muy bien, iré al este, hacia Rivendel
1396;Llevaré a Sam a ver a los elfos, cosa que le encantará.Hablaba superficialmente, pero de pronto el corazón le dio un vuelco con el deseo de ver la casa de Elrond el Medio Elfo y respirar el aire de aquel valle profundo donde mucha Hermosa Gente vivía todavía en paz
1397;Una tarde de verano, una asombrosa noticia llegó a La Mata de Hiedra y El Dragón Verde
1398;Los gigantes y los otros portentos de los límites de la Comarca quedaron relegados a segundo lugar
1399;Había asuntos más importantes.¡El señor Frodo vendía Bolsón Cerrado! ¡Ya lo había vendido a los SacovillaBolsón! «Por una bagatela», decían algunos.«A precio de ocasión», decían otros, «y así será, si la señora Lobelia es la compradora».(Otho había muerto algunos años antes, a la madura aunque decepcionante edad de ciento dos años.) La razón por la que el señor Frodo vendía su hermosa cueva se discutía todavía más que el precio
1400;Unos pocos sostenían la teoría, apoyada por las indirectas e insinuaciones del mismo señor Bolsón, de que el dinero se le estaba agotando a Frodo
1401;Abandonaría Hobbiton y viviría en Los Gamos de manera sencilla, entre sus parientes, los Brandigamo, con lo obtenido en la venta de Bolsón Cerrado.«Lo más lejos que pueda de los SacovillaBolsón», agregaban algunos
1402;Estaban tan convencidos de las riquezas inmensas de los Bolsón de Bolsón Cerrado que a la mayoría todo esto le parecía increíble
1403;Mucho más difícil que cualquier otra razón o sinrazón que la imaginación pudiera inventar
1404;Para muchos era un plan sombrío, inconfesable, de Gandalf, quien si bien se mantenía muy tranquilo, y no salía durante el día, era sabido que se «escondía en Bolsón Cerrado»
1405;Pero como quiera que el cambio se acomodase o no a los planes del hechicero, algo era indudable: Frodo volvía a Los Gamos
1406;Sí, me mudaré este otoño decía
1407;Merry Brandigamo me está buscando una pequeña pero hermosa cueva, o quizás una casita
1408;En realidad, Frodo había elegido y comprado con la ayuda de Merry una casita en Cricava más allá de Gamoburgo
1409;Para todos, excepto Sam, Frodo simuló que se establecería allí permanentemente
1410;La decisión de partir hacia el este le sugirió tal idea, pues Los Gamos se encontraba en el límite oriental de la Comarca y como había pasado allí la niñez, el regreso podía parecer verosímil
1411;Gandalf permaneció en la Comarca dos meses más
1412;Luego, una tarde, a fines de junio, casi en seguida de que el plan de Frodo quedara establecido de modo definitivo, anunció que partía a la mañana siguiente
1413;Sólo por un corto período, espero dijo
1414;Iré más allá de la frontera sur para recoger algunas noticias, si es posible
1415;He estado sin hacer nada demasiado tiempo
1416;Hablaba en un tono ligero, pero a Frodo le pareció que estaba preocupado.¿Alguna novedad? preguntó
1417;No
1418;Pero he oído algo que me inquieta y que es imprescindible investigar
1419;Si creo necesario que partas inmediatamente, volveré en seguida, o al menos te enviaré un mensaje
1420;Mientras tanto no te desvíes del plan, pero sé más cuidadoso que nunca, sobre todo con el Anillo
1421;Permíteme que insista: ¡No lo uses! El Señor de los anillos: La Comunidad del anillo 56 Gandalf partió al amanecer.Volveré un día de éstos dijo
1422;Como máximo estaré de vuelta para la fiesta de despedida
1423;Después de todo, quizá necesites que te acompañe
1424;"Al principio, Frodo estuvo muy preocupado y pensaba a menudo en lo que Gandalf podía haber oído; pero al fin se tranquilizó y cuando llegó el buen tiempo olvidó del todo el problema"
1425;"Pocas veces se había visto en la Comarca un verano más hermoso y un otoño más opulento; los árboles estaban cargados con manzanas, la miel rebosaba en los panales y el grano estaba alto y henchido"
1426;Muy entrado el otoño, la suerte de Gandalf comenzó a inquietar de nuevo a Frodo
1427;Terminaba septiembre y no había noticias del mago
1428;El cumpleaños y la mudanza se acercaban y no había aparecido ni había enviado ningún mensaje
1429;Comenzó el ajetreo en Bolsón Cerrado
1430;Algunos amigos de Frodo llegaron para ayudarlo a embalar: allí estaban Fredegar Bolger, Folco Boffin y los más íntimos: Pippin Tuk y Merry Brandigamo
1431;Entre todos dieron vuelta a la casa
1432;El veinte de septiembre, dos vehículos cubiertos partieron cargados hacia Los Gamos, a través del Puente del Brandivino, llevando al nuevo hogar los enseres y muebles que Frodo no había vendido
1433;Al día siguiente Frodo estaba realmente inquieto y clavaba los ojos afuera esperando a Gandalf
1434;La mañana del jueves, día de su cumpleaños, amaneció tan clara y brillante como aquella otra, de hacía mucho tiempo, en ocasión de la fiesta de Bilbo
1435;Gandalf no había aparecido aún
1436;En la tarde Frodo dio su fiesta de despedida: una cena muy pequeña, para él y sus cuatro ayudantes, pero estaba preocupado y con poco ánimo para esas cosas
1437;El pensamiento de que pronto tendría que separarse de sus jóvenes amigos le pesaba en el corazón
1438;Se preguntaba cómo lo diría
1439;Los cuatro jóvenes hobbits estaban muy animados, sin embargo, y la reunión pronto se hizo muy alegre, a pesar de la ausencia de Gandalf
1440;"El comedor parecía vacío; tenía sólo una mesa y sillas; pero la comida era buena y el vino excelente"
1441;El vino de Frodo no se había incluido en la venta a los SacovillaBolsón
1442;Suceda lo que suceda con el resto de mis cosas, cuando los SacovillaBolsón las tomen entre sus garras yo ya habré encontrado un buen destino para esto dijo Frodo mientras vaciaba el vaso
1443;Era la última gota de los viejos viñedos
1444;Luego de haber cantado muchas canciones y hablado de muchas cosas que habían hecho juntos, brindaron por el cumpleaños de Bilbo y bebieron junto con Frodo a la salud de todos, como era costumbre de Frodo
1445;Luego salieron a respirar un poco de aire, echaron una mirada a las estrellas y se fueron a dormir
1446;Con esto terminó la fiesta de Frodo, y Gandalf no había llegado
1447;A la mañana siguiente continuaron atareados cargando otro carro con el resto del equipaje
1448;Merry se ocupó de todo esto, y junto con el Gordo (Fredegar Bolger) marcharon hacia el nuevo domicilio de Frodo
1449;Alguien tiene que ir allí, Frodo, y entibiar la casa antes que llegues dijo Merry
1450;Te veré luego, pasado mañana, si no te quedas dormido en el camino
1451;Folco volvió a su casa después del almuerzo, pero Pippin se quedó atrás
1452;Frodo estaba inquieto, ansioso, aguardando en vano a Gandalf
1453;Decidió El Señor de los anillos: La Comunidad del anillo 57 esperar hasta la caída de la noche
1454;Luego, si Gandalf lo necesitaba urgentemente, podría ir a Cricava y hasta quizá llegara antes que él
1455;"Frodo iría a pie; el plan, por placer, tanto como por cualquier otra razón, era caminar cómodamente desde Hobbiton hasta Balsadera en Gamoburgo y echar una última mirada a la Comarca"
1456;Tengo que entrenarme un poco dijo, mirándose en un espejo polvoriento del vestíbulo casi vacío
1457;No hacía caminatas largas desde mucho tiempo atrás y la imagen, opinó, no daba una impresión de vigor
1458;Después del almuerzo, aparecieron los SacovillaBolsón, Lobelia y su hijo Lotho, el pelirrojo
1459;Frodo se sintió bastante molesto
1460;¡Nuestra al fin! exclamó Lobelia, al tiempo que entraba
1461;No era ni cortés ni estrictamente verdadero, pues la venta de Bolsón Cerrado no se realizó hasta la medianoche
1462;"Pero se podía perdonar a Lobelia; se había visto obligada a esperar setenta y siete años a que Bolsón Cerrado fuese suyo y ahora tenía cien años"
1463;De cualquier modo, había vuelto para cuidar que no faltase nada de lo que había comprado y quería las llaves
1464;Llevó largo rato satisfacerla, pues había traído un inventario completo que verificó punto por punto
1465;Al fin partió con Lotho, la llave de repuesto y la promesa de que podría recoger la otra llave en la casa de Gamyi, en Bolsón de Tirada
1466;Resopló, mostrando claramente que suponía a los Gamyi capaces de meterse de noche en la cueva
1467;Frodo ni siquiera le ofreció una taza de té
1468;Tomó su propio té en la cocina con Pippin y Sam Gamyi
1469;Se había anunciado oficialmente que Sam iría a Los Gamos «a ayudar al señor Frodo y cuidar el jardincito»
1470;Un arreglo que el Tío apoyó, aunque no lo consoló de la perspectiva de tener a Lobelia como vecina
1471;¡Nuestra última comida en Bolsón Cerrado! exclamó Frodo, retirando la silla
1472;Dejaron a Lobelia el lavado de los platos
1473;"Pippin y Sam ataron los tres fardos y los apilaron en el vestíbulo; luego Pippin salió a dar una última vuelta por el jardín"
1474;Sam desapareció
1475;"El sol se puso; Bolsón Cerrado parecía triste, melancólico, desmantelado"
1476;Frodo vagaba por las habitaciones familiares y vio la luz del crepúsculo que se borraba en las paredes y las sombras que trepaban por los rincones
1477;Adentro oscureció lentamente
1478;Salió de la habitación, descendió hacia la puerta que estaba en el extremo del sendero y anduvo un trecho por el camino de la colina
1479;Tenía cierta esperanza de ver a Gandalf subiendo a grandes zancadas en el crepúsculo
1480;El cielo estaba claro y las estrellas brillaban cada vez más
1481;Será una hermosa noche dijo en voz alta
1482;Buen comienzo
1483;Tengo ganas de echar a caminar
1484;No puedo seguir esperando
1485;Partiré y Gandalf tendrá que seguirme
1486;Volvió sobre sus pasos y se detuvo al oír voces que venían de Bolsón de Tirada
1487;Una voz era sin duda la del Tío, la otra era extraña y en cierto modo desagradable
