;Phrase
3510;Todos los hombres de Bree parecían tener nombres botánicos (y bastante raros para la gente de la Comarca), tales como juncales, Madreselva, Matosos, Manzanero, Cardoso y Helechal (y Cebadilla Mantecona)
3511;Algunos hobbits tenían nombres similares
3512;Los Artemisa, por ejemplo, parecían numerosos
3513;Pero la mayoría llevaba nombres sacados de accidentes naturales como Bancos, Tejonera, Cuevas, Arenas y Tunelo, muchos de los cuales eran comunes en la Comarca
3514;Había varios Sotomonte de Entibo y como no alcanzaban a imaginar que compartiesen un nombre y no fuesen parientes, tomaron cariñosamente a Frodo por un primo perdido hacía tiempo
3515;Los hobbits de Bree eran en verdad amables y curiosos y Frodo pronto se dio cuenta de que tendría que dar alguna explicación de lo que hacía
3516;Dijo que le interesaban la geografía y la historia (y aquí hubo muchos cabeceos de asentimiento, aunque estas palabras no eran muy comunes en el dialecto de Bree)
3517;Declaró que pensaba escribir un libro (lo que provocó un asombro mudo) y que él y sus amigos deseaban informarse acerca de los hobbits que vivían fuera de la Comarca, sobre todo en las tierras del oeste
3518;Junto con este anuncio estalló un coro de voces
3519;Si Frodo hubiese querido realmente escribir un libro y hubiera tenido muchas orejas, habría reunido material para varios capítulos en unos pocos minutos
3520;Y como si esto no fuera suficiente le dieron toda una lista de nombres, encabezada por «nuestro viejo Cebadilla», a quienes podía recurrir en busca de más información
3521;Pero al cabo de un rato, como Frodo no diera ninguna señal de querer escribir un libro allí mismo y en seguida, los hobbits de Bree volvieron a hacer preguntas sobre lo que pasaba en la Comarca
3522;Frodo no se mostró muy comunicativo y pronto se encontró solo, sentado en un rincón, escuchando y mirando alrededor
3523;Los hombres y los enanos hablaban sobre todo de acontecimientos distantes y daban noticias de una especie que era ya demasiado familiar
3524;Había problemas allá en el Sur y parecía que los hombres que habían venido por el Camino Verde habían partido en busca de tierras donde pudieran encontrar un poco de paz
3525;Las gentes de Bree los trataban con simpatía, pero no parecían muy dispuestos a recibir un gran número de extranjeros en aquellos reducidos territorios
3526;Uno de los viajeros, bizco, poco agraciado, pronosticaba que en el futuro cercano más y más gente subiría al norte.El Señor de los anillos: La Comunidad del anillo 133 Si no les encuentran lugar, lo encontrarán ellos mismos
3527;Tienen derecho a vivir, tanto como otros dijo con voz fuerte
3528;Los habitantes del lugar no parecían muy complacidos con esta perspectiva
3529;Los hobbits no prestaron mucha atención a todo esto, que por el momento no parecía concernir a la Comarca
3530;Era difícil que la Gente Grande pretendiera alojarse en los agujeros de los hobbits
3531;Estaban aquí más interesados en Sam y Pippin, que ahora se sentían muy cómodos y charlaban animadamente sobre los acontecimientos de la Comarca
3532;Pippin provocó una buena cantidad de carcajadas contando cómo se vino abajo el techo en la alcaldía de Cavada Grande
3533;Will Pieblanco, el alcalde y el más gordo de los hobbits en la Cuaderna del Oeste, había emergido envuelto en yeso, como un pastel enharinado
3534;Pero se hicieron también muchas preguntas, que inquietaron a Frodo
3535;Uno de los habitantes de Bree, que parecía haber estado varias veces en la Comarca, quiso saber dónde habitaban los Sotomonte y con quién estaban emparentados
3536;De pronto Frodo notó que un hombre de rostro extraño, curtido por la intemperie, sentado en la sombra cerca de la pared, escuchaba también con atención la charla de los hobbits
3537;Tenía un tazón delante de él y fumaba una pipa de caño largo, curiosamente esculpida
3538;Las piernas extendidas mostraban unas botas de cuero blando, que le calzaban bien, pero que habían sido muy usadas y estaban ahora cubiertas de barro
3539;"Un manto pesado, de color verde oliva, manchado por muchos viajes, le envolvía ajustadamente el cuerpo y a pesar del calor que había en el cuarto llevaba una capucha que le ensombrecía la cara; sin embargo, se le alcanzaba a ver el brillo de los ojos, mientras observaba a los hobbits"
3540;¿Quién es? susurró Frodo cuando tuvo cerca al señor Mantecona
3541;No recuerdo que usted nos haya presentado
3542;¿El? respondió el posadero en voz baja, apuntando con un ojo y sin volver la cabeza
3543;No lo sé muy bien
3544;Es uno de esos que van de un lado a otro
3545;Montaraces, los llamamos
3546;Habla raras veces, aunque sabe contar una buena historia cuando tiene ganas
3547;Desaparece durante un mes, o un año, y se presenta aquí de nuevo
3548;Se fue y vino muchas veces en la primavera pasada, pero no lo veía desde hace tiempo
3549;El nombre verdadero nunca lo oí, pero por aquí se le conoce como Trancos
3550;Anda siempre a grandes pasos, con esas largas zancas que tiene, aunque nadie sabe el porqué de tanta prisa
3551;Pero no hay modo de entender a los del Este y tampoco a los del Oeste, como decimos en Bree, refiriéndonos a los montaraces y a las gentes de la Comarca, con el perdón de usted
3552;Raro que me lo haya preguntado.Pero en ese momento alguien llamó pidiendo más cerveza y el señor Mantecona se fue dejando en el aire su última frase
3553;Frodo notó que Trancos estaba ahora mirándolo, como si hubiera oído o adivinado todo lo que se había dicho
3554;Casi en seguida, con un movimiento de la mano y un cabeceo, invitó a Frodo a que se sentara junto a él
3555;Frodo se acercó y el hombre se sacó la capucha descubriendo una hirsuta cabellera oscura con mechones canosos y un par de ojos grises y perspicaces en una cara pálida y severa
3556;Me llaman Trancos dijo con una voz grave
3557;Me complace conocerlo, señor...Sotomonte, si el viejo Mantecona ha oído bien el nombre de usted.El Señor de los anillos: La Comunidad del anillo 134 Ha oído bien dijo Frodo tiesamente
3558;No se sentía nada cómodo bajo la mirada de aquellos ojos penetrantes
3559;Bien, señor Sotomonte dijo Trancos, si yo fuera usted, trataría de que esos jóvenes amigos no hablaran demasiado
3560;La bebida, el fuego y los conocidos casuales son bastante agrada bles, pero, bueno...esto no es la Comarca
3561;Hay gente rara por aquí
3562;Aunque usted pensará que no soy yo quien tiene que decirlo añadió con una sonrisa torcida, viendo la mirada que le echaba Frodo
3563;Y otros viajeros todavía más extraños han pasado últimamente por Bree continuó observando la cara del hobbit
3564;Frodo le devolvió la mirada, pero no replicó y Trancos calló también
3565;Ahora parecía interesado en Pippin
3566;Frodo, alarmado, se dio cuenta de que el ridículo joven Tuk, animado por el éxito que había tenido su historia sobre el alcalde de Cavada Grande, estaba dando una versión cómica de la fiesta de despedida de Bilbo
3567;Imitaba ahora el discurso y se acercaba al momento de la asombrosa desaparición.Frodo se sintió fastidiado
3568;"Era sin duda una historia bastante inofensiva para la mayoría de los hobbits locales; sólo una historia rara sobre esas gentes raras que vivían más allá del río; pero algunos (el viejo Mantecona, por ejemplo) no habían nacido ayer y era probable que hubiesen oído algo tiempo atrás acerca de la desaparición de Bilbo"
3569;Esto les traería a la memoria el nombre de Bolsón, principalmente si se había preguntado por este nombre en Bree
3570;Frodo se movió en el asiento, sin saber qué hacer
3571;Pippin disfrutaba ahora de modo evidente del interés que despertaba en los demás y había olvidado el peligro en que se encontraban
3572;Frodo temió de pronto que arrastrado por la historia Pippin llegara a mencionar el Anillo, lo que podía ser desastroso
3573;¡Será mejor que haga algo y rápido! le susurró Trancos al oído
3574;Frodo se subió de un salto a una mesa y empezó a hablar
3575;Los oyentes de Pippin se volvieron a mirarlo
3576;Algunos hobbits rieron y aplaudieron, pensando que el señor Sotomonte había tomado demasiada cerveza
3577;Frodo se sintió de pronto ridículo y se encontró (como era su costumbre cuando pronunciaba un discurso) jugueteando con las cosas que llevaba en el bolsillo
3578;Tocó el Anillo y la cadena, e inesperadamente tuvo el deseo de ponérselo en el dedo y desaparecer, escapando así de aquella tonta situación
3579;Le pareció, de algún modo, que la idea le había venido de afuera, de alguien o algo en el cuarto
3580;Resistió firmemente la tentación y apretó el Anillo en la mano, como para asegurarlo e impedirle escapar o hacer algún disparate
3581;De cualquier modo el Anillo no lo inspiró
3582;"Pronunció «unas pocas palabras de circunstancias», como hubiesen dicho en la Comarca: Estamos todos muy agradecidos por tanta amabilidad y me atre vo a esperar que mi breve visita ayudará a renovar los viejos lazos de amistad entre la Comarca y Bree; y luego titubeó y tosió"
3583;Todos en la sala estaban ahora mirándolo
3584;¡Una canción! gritó uno de los hobbits.¡Una canción! ¡Una canción! gritaron todos los otros.¡Vamos, señor, cántenos algo que no hayamos oído antes! Durante un rato Frodo se quedó allí, de pie sobre la mesa, boquiabierto
3585;"Luego, desesperado, se puso a cantar; era una canción ridícula que Bilbo había estimado bastante (y de la que en realidad se había sentido orgulloso, pues él mismo era el autor de la letra)"
3586;Se hablaba en ella de una posada y fue El Señor de los anillos: La Comunidad del anillo 135 esa quizá la razón por la que le vino a la memoria en ese momento
3587;Hela aquí en su totalidad
3588;Hoy, en general, sólo se recuerdan unas pocas palabras
3589;Hay una posada, una vieja y alegre posada al pie de una vieja colina gris, y allí preparan una cerveza tan oscura que una noche bajó a beberla el Hombre de la Luna
3590;"El palafrenero tiene un gato borracho que toca un violín de cinco cuerdas; y el arco se mueve bajando y subiendo, arriba rechinando, abajo ronroneando, y serruchando en el medio"
3591;"El posadero tiene un perrito que es muy aficionado a las bromas; y cuando en los huéspedes hay alegría, levanta una oreja a todos los chistes y se muere de risa"
3592;"Ellos tienen también una vaca cornuda orgullosa como una reina; la música la trastorna como una cerveza y mueve la cola empenachada y baila en la hierba"
3593;¡Oh las pilas de fuentes de plata y el cajón de cucharas de plata! Hay un par especial de domingo que ellos pulen con mucho cuidado la tarde del sábado
3594;"El Hombre de la Luna bebía largamente y el gato se puso a llorar; la fuente y la cuchara bailaban en la consola, y la vaca brincaba en el jardín, y el perrito se mordía la cola"
3595;"El Hombre de la Luna empinó el codo y luego rodó bajo la silla, y allí durmió soñando con cerveza; hasta que el alba estuvo en el aire y se borraron las estrellas"
3596;Luego el palafrenero le dijo al gato ebrio: Los caballos blancos de la luna tascan los frenos de plata y relinchan pero el amo ha perdido la cabeza, ¡y ya viene el día! El Señor de los anillos: La Comunidad del anillo 136 El gato en el violín toca una jigajiga que despertaría a los muertos, Chillando, serruchando, apresurando la tonada, y el posadero sacude al Hombre de la Luna, diciendo: ¡Son las tres pasadas! Llevan al hombre rodando loma arriba y lo arrojan a la luna, mientras que los caballos galopan de espaldas y la vaca cabriola como un ciervo y la fuente se va con la cuchara
3597;"Más rápido el violín toca la jigajiga; la vaca y los caballos están patas arriba, y el perro lanza un rugido, y los huéspedes ya saltan de la cama y bailan en el piso"
3598;¡Las cuerdas del violín estallan con un pum! La vaca salta por encima de la luna, y el perrito se ríe divertido, y la fuente del sábado se escapa corriendo con la cuchara del domingo
3599;La luna redonda rueda detrás de la colina, mientras el sol levanta la cabeza, y con ojos de fuego observa estupefacta 1 que aunque es de día todos volvieron a la cama
3600;El aplauso fue prolongado y ruidoso
3601;Frodo tenía una buena voz y la fantasía de la canción había agradado a todos
3602;¿Por dónde anda el viejo Cebadilla? exclamaron
3603;Tiene que oírla
3604;Bob podría enseñarle al gato a tocar el violín y tendríamos un baile.–Pidieron una nueva vuelta de cerveza y gritaron: ¡Cántela otra vez, señor! ¡Vamos! ¡Otra vez! Hicieron tomar un jarro más a Frodo, que recomenzó la canción y muchos se le unieron, pues la melodía era muy conocida y se les había pegado la letra
3605;Le tocó a Frodo entonces sentirse satisfecho de sí mismo
3606;Zapateaba sobre la mesa y cuando llegó por segunda vez a la vaca salta por encima de la luna, dio un salto en el aire demasiado vigoroso
3607;Frodo cayó, bum, sobre una bandeja repleta de jarros, resbaló y fue a parar bajo la mesa con un estruendo, un alboroto y un golpe sordo
3608;"Todos abrieron la boca preparados para reír y se quedaron petrificados en un silencio sin aliento, pues el cantor ya no estaba allí.¡Había desaparecido como si hubiera pasado directamente a través del piso de la sala sin dejar ni la huella de un agujero! Los hobbits locales se quedaron mirando mudos de asombro; en seguida se incorporaron de un salto y llamaron a gritos a Cebadilla"
3609;Todos se apartaron        1 Para los elfos (y los hobbits) el sol es de género femenino.El Señor de los anillos: La Comunidad del anillo 137 de Pippin y Sam, que se encontraron solos en un rincón, observados desde lejos con miradas sombrías y desconfiadas
3610;Estaba claro que para la mayoría de la gente ellos eran los compañeros de un mago ambulante con poderes y propósitos desconocidos
3611;"Pero había un vecino de Bree, de tez oscura, que los miraba con la expresión de alguien que está sobre aviso y con una cierta ironía; Pippin y Sam se sentían de veras incómodos"
3612;"Casi en seguida el hombre se escurrió fuera del salón, seguido por el sureño bizco; los dos habían pasado gran parte de la noche hablando juntos en voz baja"
3613;Herry, el guardián de la puerta, salió también detrás de ellos
3614;Frodo se daba cuenta de que había cometido una estupidez
3615;No sabiendo qué hacer, se arrastró por debajo de las mesas hacia el rincón sombrío donde Trancos estaba todavía sentado, impasible
3616;Se apoyó de espaldas contra la pared y se quitó el Anillo
3617;Cómo le había llegado al dedo, no podía recordarlo
3618;Era posible que hubiese estado jugueteando con él en el bolsillo, mientras cantaba y que en el momento de sacar bruscamente la mano para evitar la caída, se le hubiera deslizado de algún modo en el dedo
3619;"Durante un instante se preguntó si el Anillo mismo no le había jugado una mala pasada; quizás había tratado de hacerse notar en respuesta al deseo o la orden de alguno de los huéspedes"
3620;No le gustaba el aspecto de los hombres que habían dejado el salón
3621;¿Bien? dijo Trancos cuando Frodo reapareció.¿Por qué lo hizo? Cualquier indiscreción de los amigos de usted no hubiera sido peor
3622;Ha metido usted la pata.¿O tendría que decir el dedo? No sé a qué se refiere dijo Frodo molesto y alarmado.Oh, sí que lo sabe respondió Trancos, pero será mejor esperar a que pase el alboroto
3623;Luego, si usted me permite, señor Bolsón, me agradaría que tuviésemos una charla tranquila
3624;¿A propósito de qué? preguntó Frodo aparentando no haber oído su verdadero nombre
3625;A propósito de un asunto de cierta importancia, tanto para usted como para mí respondió Trancos mirando a Frodo a los ojos
3626;Quizás oiga algo que le conviene.Muy bien dijo Frodo tratando de mostrarse indiferente
3627;Hablaré con usted más tarde
3628;Mientras, junto a la chimenea se desarrollaba una discusión
3629;El señor Mantecona había llegado al trote y ahora trataba de escuchar a la vez varios relatos contradictorios sobre lo que había ocurrido
3630;Yo lo vi, señor Mantecona dijo un hobbit, por lo menos no lo vi más, si usted me entiende
3631;Se desvaneció en el aire, como quien dice
3632;¡No es posible, señor Artemisa! dijo el posadero, perplejo.Sí replicó Artemisa
3633;Y además sé lo que digo.Hay algún error en alguna parte dijo Mantecona sacudiendo la cabeza
3634;Había demasiado de ese señor Sotomonte para que se desvaneciese así en el aire, o en el humo, lo que sería más exacto si ocurrió en esta habitación
3635;Bueno, ¿dónde está ahora? gritaron varias voces.¿Cómo podría saberlo? Puede irse a donde quiera, siempre que pague por la mañana
3636;Y aquí está el señor Tuk, que no ha desaparecido.Bueno, vi lo que vi y vi lo que El Señor de los anillos: La Comunidad del anillo 138 no vi dijo Artemisa, obstinado.Y yo digo que hay aquí algún error repitió Mantecona recogiendo la bandeja y los restos de los jarros
3637;¡Claro que hay un error! dijo Frodo
3638;No he desaparecido.¡Aquí estoy! He tenido sólo una pequeña charla con el señor Trancos en el rincón
3639;Frodo se adelantó a la luz del fuego, pero la mayoría de los huéspedes dio un paso atrás, aún más perturbados que antes
3640;No los satisfacía la explicación de Frodo, según la cual se había arrastrado rápidamente por debajo de las mesas luego de la caída
3641;La mayoría de los hobbits y de las gentes de Bree se apresuraron a irse, sin ganas ya de seguir divirtiéndose esa noche
3642;Unos pocos echaron a Frodo una mirada sombría y partieron murmurando entre ellos
3643;Los enanos y dos o tres hombres extraños que todavía estaban allí se pusieron de pie y dieron las buenas noches al posadero pero no a Frodo y sus amigos
3644;Poco después no quedaba nadie sino Trancos, todavía sentado en las sombras junto a la pared
3645;El señor Mantecona no parecía muy preocupado
3646;Pensaba, probablemente, que el salón estaría repleto durante muchas noches, hasta que el misterio actual fuera discutido a fondo
3647;Y ahora, ¿qué ha estado haciendo, señor Sotomonte? preguntó.¿Asustando a mis clientes y haciendo trizas mis jarros con esas acrobacias? Lamento mucho haber causado alguna dificultad dijo Frodo
3648;No tuve la menor intención, se lo aseguro
3649;Fue un desgraciado accidente
3650;Muy bien, señor Sotomonte
3651;Pero si va usted a intentar otros juegos, o conjuros, o lo que sea, mejor que antes advierta a la gente y que me advierta a mí
3652;Aquí somos un poco recelosos de todo lo que salga de lo común, de todo lo misterioso, si usted me entiende, y tardamos en acostumbrarnos
3653;No haré nada parecido otra vez, señor Mantecona, se lo prometo
3654;Y ahora creo que me iré a la cama
3655;Partimos temprano.¿Podría ordenar que nuestros poneys estén preparados para las ocho? ¡Muy bien! Pero antes que se vaya quiero tener con usted unas palabras en privado, señor Sotomonte
3656;Acabo de recordar algo que usted tiene que saber
3657;Espero no molestarle
3658;Cuando haya arreglado una o dos cositas, iré al cuarto de usted, si no le parece mal
3659;¡Claro que no! dijo Frodo, sintiendo que se le encogía el corazón
3660;Se preguntó cuántas charlas privadas tendría que sobrellevar antes de poder acostarse y qué revelarían.¿Estaba toda esta gente ligada contra él? Empezaba a sospechar que aun la cara redonda del viejo Mantecona ocultaba unos negros designios.El Señor de los anillos: La Comunidad del anillo 139 10 TRANCOS Frodo, Pippin y Sam volvieron a la salita
3661;No había luz
3662;Merry no estaba allí y el fuego había bajado
3663;Sólo después de avivar un rato las llamas y de haberlas alimentado con un par de troncos, descubrieron que Trancos había venido con ellos.¡Estaba tranquilamente sentado en una silla junto a la puerta! ¡Hola! dijo Pippin.¿Quién es usted y qué desea? Me llaman Trancos dijo el hombre, y aunque quizá lo haya olvidado, el amigo de usted me prometió tener conmigo una charla tranquila
3664;Usted dijo que yo me enteraría de algo que quizá me fuera útil dijo Frodo.¿Qué tiene que decir? Varias cosas dijo Trancos
3665;Pero, por supuesto, tengo mi precio.¿Qué quiere decir? preguntó Frodo ásperamente
3666;¡No se alarme! Sólo esto: le contaré lo que sé y le daré un buen consejo
3667;Pero quiero una recompensa
3668;¿Qué recompensa? dijo Frodo, pensando ahora que había caído en manos de un pillo y recordando con disgusto que había traído poco dinero
3669;El total no contentaría de ningún modo a un bribón y no podía distraer ni siquiera una parte
3670;Nada que usted no pueda permitirse respondió Trancos con una lenta sonrisa, como si adivinara los pensamientos de Frodo
3671;Sólo esto: tendrá que llevarme con usted hasta que yo decida dejarlo
3672;Oh, ¿de veras? replicó Frodo, sorprendido, pero no muy aliviado
3673;Aun en el caso de que yo deseara otro compañero, no consentiría hasta saber bastante más de usted y de sus asuntos
3674;¡Excelente! exclamó Trancos cruzando las piernas y acomodándose en la silla
3675;"Parece que está usted recobrando el buen sentido; mejor así"
3676;Hasta ahora ha sido demasiado descuidado.¡Muy bien! Le diré lo que sé y usted dirá si merezco la recompensa
3677;Quizá me la conceda de buen grado, luego de haberme oído
3678;"¡Adelante entonces! dijo Frodo.¿Qué sabe usted? Demasiado; demasiadas cosas sombrías dijo Trancos torvamente"
3679;Pero en cuanto a los asuntos de usted...Se in corporó, fue hasta la puerta, la abrió rápidamente y miró fuera
3680;Luego cerró en silencio y se sentó otra vez.Tengo oído fino continuó bajando la voz, y aunque no puedo desaparecer, he seguido las huellas de muchas criaturas salvajes y cautelosas y comúnmente evito que me vean, si así lo deseo
3681;Pues bien, yo estaba detrás de la empalizada esta tarde en el camino al oeste de Bree, cuando cuatro hobbits vinieron de las Quebradas
3682;No necesito repetir todo lo que hablaron con el viejo Bombadil o entre ellos, pero una cosa me interesó
3683;Por favor, recordad todos, dijo uno de ellos, que el nombre de Bolsón no ha de mencionarse.Si es necesario darme un nombre soy el señor Sotomonte
3684;Esto me interesó tanto que los seguí hasta aquí
3685;Me deslicé por encima de la cerca justo detrás de ellos
3686;"Quizás el señor Bolsón tiene un buen motivo para cambiar de nombre; pero si es así, les aconsejaré a él y a sus amigos que sean más cuidadosos"
3687;No veo por qué mi nombre ha de interesar a la gente de Bree dijo Frodo, irritado y todavía ignoro por qué le interesa a usted
3688;"El señor Trancos puede El Señor de los anillos: La Comunidad del anillo 140 tener buenos motivos para espiar y escuchar indiscretamente; pero si es así, le aconsejaré que se explique"
3689;¡Bien respondido! dijo Trancos riéndose .Pero la explicación es simple: busco a un hobbit llamado Frodo Bolsón
3690;Quiero encontrarlo en seguida
3691;Supe que estaba llevando fuera de la Comarca, bueno, un secreto que nos concierne, a mí y a mis amigos
3692;»¡Un momento, no me interpreten mal! gritó al tiempo que Frodo se ponía de pie y Sam daba un salto con aire amenazador
3693;Cuidaré del secreto mejor que ustedes.¡Y hay que cuidarse de veras! Se inclinó hacia adelante y los miró
3694;¡Vigilen todas las sombras! dijo en voz baja
3695;Unos Jinetes Negros han pasado por Bree
3696;Dicen que el lunes llegó uno por el Camino Verde y otro apareció más tarde, subiendo por el Camino Verde desde el sur
3697;Se hizo un silencio
3698;Al fin Frodo les habló a Pippin y Sam.Tenía que haberlo sospechado por el modo en que nos recibió el guardián dijo
3699;Y el posadero parece haber oído algo.¿Por qué insistió en que nos uniéramos a los demás? ¿Y por qué razón nos comportamos como tontos? Teníamos que habernos quedado aquí tranquilamente
3700;Hubiese sido mejor dijo Trancos
3701;Yo hubiera impedido que fueran al salón, pero no me fue posible
3702;El posadero no hubiese permitido que yo los viera, ni les hubiera traído un mensaje
3703;Cree usted que...comenzó Frodo
3704;No, no pienso mal del viejo Mantecona
3705;Pero los vagabundos misteriosos como yo no le gustan demasiado.Frodo lo miró con perplejidad
3706;Bueno, tengo cierto aspecto de villano, ¿no es así? dijo Trancos con una mueca de desdén y un brillo extraño en los oj os
3707;Pero espero que lleguemos a conocernos mejor
3708;Cuando así sea, confío en que me explicará usted qué ocurrió al fin de la canción
3709;Porque esa pirueta..
3710;¡Fue sólo un accidente! interrumpió Frodo
3711;Bueno dijo Trancos, accidente entonces
3712;Ese accidente ha empeorado la situación de usted
3713;No demasiado dijo Frodo
3714;Yo ya sabía que esos Jinetes estaban persiguiéndome, pero de todos modos creo que me perdieron el rastro y se han ido
3715;¡No cuente con eso! dijo Trancos vivamente .Volverán y vendrán más
3716;Hay otros
3717;Sé cuántos son
3718;Conozco a esos Jinetes.Hizo una pausa y sus ojos eran fríos y duros
3719;Y hay gente en Bree en la que no se puede confiar continuó
3720;Bill Helechal, por ejemplo
3721;Tiene mala reputación en el país de Bree, y gente extraña llama a su casa
3722;Lo habrá visto usted entre los huéspedes: un sujeto moreno y burlón
3723;Estaba muy cerca de uno de esos extranjeros del sur y salieron todos juntos en seguida del «accidente»
3724;"No todos los sureños son buena gente y en cuanto a Helechal, le vendería cualquier cosa a cualquiera; o haría daño por el placer de hacerlo"
3725;¿Qué vendería Helechal y qué relación tiene con mi accidente? dijo Frodo, decidido todavía a no entender las insinuaciones de Trancos
3726;Noticias de usted, por supuesto respondió Trancos
3727;Un relato de la hazaña de usted sería muy interesante para cierta gente
